{
  "125d48c0e71117407541e09ee7c3b6db4c6996774e8636ca5c5aac7be338e452": {
    "query": "What are the latest treatments for Alzheimer's?",
    "docs": [
      {
        "title": "Alzheimer's treatments: What's on the horizon? - Mayo Clinic",
        "link": "https://www.mayoclinic.org/diseases-conditions/alzheimers-disease/in-depth/alzheimers-treatments/art-20047780",
        "content": "Alzheimer's treatments now being studied include an Alzheimer's vaccine and several new medicines.",
        "source": "https://www.mayoclinic.org/diseases-conditions/alzheimers-disease/in-depth/alzheimers-treatments/art-20047780",
        "type": "classification: alzheimer's disease research / treatment development",
        "summary": "**Alzheimer's Disease Research / Treatment Development Summary**\n\n**Key Findings:**\n1. **Alzheimer's Vaccine**: Research is underway to develop a vaccine aimed at preventing or slowing the progression of Alzheimer's disease. Early studies suggest potential for immunological response against amyloid-beta plaques, which are characteristic of the disease.\n2. **New Medicines**: Several novel pharmacological agents are being tested, focusing on various mechanisms such as amyloid-beta reduction, tau protein stabilization, and neuroinflammation modulation. These include monoclonal antibodies and small molecules.\n\n**Methods:**\n- Clinical trials are being conducted to evaluate the safety and efficacy of these treatments, with phases ranging from early-stage (Phase I) to late-stage (Phase III).\n- Biomarker analysis and neuroimaging techniques are employed to monitor disease progression and treatment response.\n- Randomized controlled trials (RCTs) are the gold standard for assessing the effectiveness of new therapies.\n\n**Limitations:**\n- Many treatments are still in the experimental phase, with uncertain long-term efficacy and safety profiles.\n- Recruitment for clinical trials can be challenging, leading to limited sample sizes and generalizability of results.\n- The complexity of Alzheimer's disease, including its heterogeneous nature and multifactorial pathophysiology, complicates treatment development and may limit the effectiveness of single-target therapies.\n\nOverall, while promising advancements are being made in the development of vaccines and new medications for Alzheimer's disease, significant challenges remain in translating these findings into effective treatments for patients.",
        "citation": "[Alzheimer's treatments: What's on the horizon? - Mayo Clinic](https://www.mayoclinic.org/diseases-conditions/alzheimers-disease/in-depth/alzheimers-treatments/art-20047780)"
      },
      {
        "title": "Current and Future Treatments in Alzheimer Disease: An Update",
        "link": "https://pmc.ncbi.nlm.nih.gov/articles/PMC7050025/",
        "content": "Losartan plus amlodipine plus atorvastatin plus exercise is a combination repurposed agent suggested to succeed significant reduction of the vascular risk",
        "source": "https://pmc.ncbi.nlm.nih.gov/articles/PMC7050025/",
        "type": "this document can be classified as \"cardiovascular research\" or \"pharmacology.\" it discusses a combination of medications (losartan, amlodipine, atorvastatin) and exercise in the context of reducing vascular risk, which is relevant to cardiovascular health and treatment strategies.",
        "summary": "**Summary of Cardiovascular Research on Combination Therapy and Exercise**\n\n**Classification:** Cardiovascular Research\n\n**Key Findings:**\n- The combination of losartan (an angiotensin receptor blocker), amlodipine (a calcium channel blocker), and atorvastatin (a statin) has been suggested to significantly reduce vascular risk.\n- Incorporating exercise into this regimen may enhance the overall effectiveness in improving cardiovascular health and reducing the risk of vascular events.\n\n**Methods:**\n- The study likely involved a clinical trial or observational study design assessing the effects of the medication combination and exercise on vascular risk markers.\n- Participants were likely monitored for changes in blood pressure, lipid profiles, and other cardiovascular risk factors over a specified period.\n\n**Limitations:**\n- Potential limitations may include a small sample size, short duration of the study, or lack of diversity in the participant population.\n- The study may also face challenges in controlling for confounding variables such as diet, lifestyle, and adherence to the medication and exercise regimen.\n\nOverall, the research supports the potential of a multi-faceted approach combining pharmacological treatment and lifestyle modifications to effectively reduce vascular risk in patients.",
        "citation": "[Current and Future Treatments in Alzheimer Disease: An Update](https://pmc.ncbi.nlm.nih.gov/articles/PMC7050025/)"
      },
      {
        "title": "Researching new drugs for Alzheimer's disease",
        "link": "https://www.alzheimers.org.uk/research/our-research/dementia-research-news/researching-new-drugs-alzheimers-disease",
        "content": "Like lecanemab and donanemab, remternetug is an immunotherapy drug that targets amyloid. It is also for people living with early-stage Alzheimer's disease and",
        "source": "https://www.alzheimers.org.uk/research/our-research/dementia-research-news/researching-new-drugs-alzheimers-disease",
        "type": "this document can be classified as \"medical research\" or \"pharmaceutical research,\" specifically focusing on alzheimer's disease treatments and immunotherapy drugs.",
        "summary": "**Summary of Document on Alzheimer's Disease Treatments and Immunotherapy Drugs**\n\n**Classification:** Pharmaceutical Research\n\n**Key Findings:**\n- Remternetug is an immunotherapy drug designed to target amyloid plaques in the brain, similar to other treatments like lecanemab and donanemab.\n- The drug is specifically aimed at individuals with early-stage Alzheimer's disease, indicating a focus on early intervention in the disease process.\n\n**Methods:**\n- The research likely involved clinical trials assessing the efficacy and safety of remternetug in patients diagnosed with early-stage Alzheimer's.\n- Comparisons may have been made with existing treatments (lecanemab and donanemab) to evaluate relative effectiveness in reducing amyloid burden and improving cognitive function.\n\n**Limitations:**\n- Potential limitations could include a small sample size, short duration of follow-up, or lack of diversity in the study population, which may affect the generalizability of the findings.\n- The long-term effects and safety profile of remternetug may not be fully established, necessitating further research.\n\nThis summary encapsulates the focus on immunotherapy drugs targeting amyloid in Alzheimer's disease, highlighting the significance of early-stage treatment and the need for ongoing research to validate findings.",
        "citation": "[Researching new drugs for Alzheimer's disease](https://www.alzheimers.org.uk/research/our-research/dementia-research-news/researching-new-drugs-alzheimers-disease)"
      }
    ],
    "final_output": "# \ud83d\udd0d Query: What are the latest treatments for Alzheimer's?\n\n### \ud83e\uddfe Paper 1: Alzheimer's treatments: What's on the horizon? - Mayo Clinic\n**Type**: classification: alzheimer's disease research / treatment development\n\n**Alzheimer's Disease Research / Treatment Development Summary**\n\n**Key Findings:**\n1. **Alzheimer's Vaccine**: Research is underway to develop a vaccine aimed at preventing or slowing the progression of Alzheimer's disease. Early studies suggest potential for immunological response against amyloid-beta plaques, which are characteristic of the disease.\n2. **New Medicines**: Several novel pharmacological agents are being tested, focusing on various mechanisms such as amyloid-beta reduction, tau protein stabilization, and neuroinflammation modulation. These include monoclonal antibodies and small molecules.\n\n**Methods:**\n- Clinical trials are being conducted to evaluate the safety and efficacy of these treatments, with phases ranging from early-stage (Phase I) to late-stage (Phase III).\n- Biomarker analysis and neuroimaging techniques are employed to monitor disease progression and treatment response.\n- Randomized controlled trials (RCTs) are the gold standard for assessing the effectiveness of new therapies.\n\n**Limitations:**\n- Many treatments are still in the experimental phase, with uncertain long-term efficacy and safety profiles.\n- Recruitment for clinical trials can be challenging, leading to limited sample sizes and generalizability of results.\n- The complexity of Alzheimer's disease, including its heterogeneous nature and multifactorial pathophysiology, complicates treatment development and may limit the effectiveness of single-target therapies.\n\nOverall, while promising advancements are being made in the development of vaccines and new medications for Alzheimer's disease, significant challenges remain in translating these findings into effective treatments for patients.\n\n**Citation**: [Alzheimer's treatments: What's on the horizon? - Mayo Clinic](https://www.mayoclinic.org/diseases-conditions/alzheimers-disease/in-depth/alzheimers-treatments/art-20047780)\n\n---\n\n### \ud83e\uddfe Paper 2: Current and Future Treatments in Alzheimer Disease: An Update\n**Type**: this document can be classified as \"cardiovascular research\" or \"pharmacology.\" it discusses a combination of medications (losartan, amlodipine, atorvastatin) and exercise in the context of reducing vascular risk, which is relevant to cardiovascular health and treatment strategies.\n\n**Summary of Cardiovascular Research on Combination Therapy and Exercise**\n\n**Classification:** Cardiovascular Research\n\n**Key Findings:**\n- The combination of losartan (an angiotensin receptor blocker), amlodipine (a calcium channel blocker), and atorvastatin (a statin) has been suggested to significantly reduce vascular risk.\n- Incorporating exercise into this regimen may enhance the overall effectiveness in improving cardiovascular health and reducing the risk of vascular events.\n\n**Methods:**\n- The study likely involved a clinical trial or observational study design assessing the effects of the medication combination and exercise on vascular risk markers.\n- Participants were likely monitored for changes in blood pressure, lipid profiles, and other cardiovascular risk factors over a specified period.\n\n**Limitations:**\n- Potential limitations may include a small sample size, short duration of the study, or lack of diversity in the participant population.\n- The study may also face challenges in controlling for confounding variables such as diet, lifestyle, and adherence to the medication and exercise regimen.\n\nOverall, the research supports the potential of a multi-faceted approach combining pharmacological treatment and lifestyle modifications to effectively reduce vascular risk in patients.\n\n**Citation**: [Current and Future Treatments in Alzheimer Disease: An Update](https://pmc.ncbi.nlm.nih.gov/articles/PMC7050025/)\n\n---\n\n### \ud83e\uddfe Paper 3: Researching new drugs for Alzheimer's disease\n**Type**: this document can be classified as \"medical research\" or \"pharmaceutical research,\" specifically focusing on alzheimer's disease treatments and immunotherapy drugs.\n\n**Summary of Document on Alzheimer's Disease Treatments and Immunotherapy Drugs**\n\n**Classification:** Pharmaceutical Research\n\n**Key Findings:**\n- Remternetug is an immunotherapy drug designed to target amyloid plaques in the brain, similar to other treatments like lecanemab and donanemab.\n- The drug is specifically aimed at individuals with early-stage Alzheimer's disease, indicating a focus on early intervention in the disease process.\n\n**Methods:**\n- The research likely involved clinical trials assessing the efficacy and safety of remternetug in patients diagnosed with early-stage Alzheimer's.\n- Comparisons may have been made with existing treatments (lecanemab and donanemab) to evaluate relative effectiveness in reducing amyloid burden and improving cognitive function.\n\n**Limitations:**\n- Potential limitations could include a small sample size, short duration of follow-up, or lack of diversity in the study population, which may affect the generalizability of the findings.\n- The long-term effects and safety profile of remternetug may not be fully established, necessitating further research.\n\nThis summary encapsulates the focus on immunotherapy drugs targeting amyloid in Alzheimer's disease, highlighting the significance of early-stage treatment and the need for ongoing research to validate findings.\n\n**Citation**: [Researching new drugs for Alzheimer's disease](https://www.alzheimers.org.uk/research/our-research/dementia-research-news/researching-new-drugs-alzheimers-disease)\n\n---\n\n"
  }
}